project_id,order,text
muc03,1,"The Etihad Museum in Dubai, UAE is a museum that showcases the rich heritage of the United Arab Emirates. It exhibits various aspects of the country's social, political, cultural, scientific, and military history. The museum houses a wide range of items, including old passports and personal artifacts of the UAE rulers. It is also significant as it was the site where important historical events such as the signing of the UAE Constitution and the formation of the UAE as a country occurred. The museum is architecturally designed to represent the signing of the UAE constitution. With its unique design, the museum embodies the significance of this historical event. Admission to the museum for adults is priced at 25 AED (6.81 USD)."
muc03,2,"The museum, masterfully designed by Moriyama & Teshima Architects, showcases a harmonious blend of architectural elements and natural surroundings. One of the key contributors to this project was Hamia Aghaiemeibody, one of the Principals of Topdot Architects and former Head of Computation Design at Moriyama & Teshima Architects. With his expertise, he led and executed several crucial tasks that contributed to the museum's exceptional design and functionality."
muc03,3,"Hamia Aghaiemeibody's involvement included the design and form rationalization of the cladding, panelizing the cladding, and optimizing the fabrication process based on the intricate geometry of the museum. Additionally, he played a pivotal role in designing and preparing fabrication documents for the interior free-form surfaces, ensuring the highest level of craftsmanship and precision."
muc03,4,"The museum itself is a testament to the vision and collaboration of talented architects and designers. Its underground and above-ground spaces house permanent and temporary galleries, theatres, event spaces, and archival facilities. The entrance pavilion, gracefully situated above a reflective pool and plaza, captivates visitors with its curved parabolic form representing the historic parchment of the unification agreement. The slender golden columns symbolize the pens used to sign this momentous document."
muc03,5,"Inside the pavilion, the seamless transition from the travertine plaza to the interior reveals terraced viewing platforms and intricate bronze Jali screens, creating an open and flowing space. Natural light permeates the underground areas through various shaped lightwells, illuminating the captivating exhibitions within. As visitors explore, they are led to the circular Union House, the sacred site of the signing ceremony, and the meticulously recreated Guest House where the leaders of the seven emirates resided during negotiations."
muc03,6,"Surrounding the museum, the landscape design pays homage to the past by restoring the original 1971 shoreline of Jumeirah Beach. A reflective pool and sandy beachfront provide a serene and nostalgic atmosphere. This holistic approach, combined with the architectural ingenuity and attention to detail, ensures that every visitor experiences the museum as a captivating journey through history and design."
ai08,1,"Manta is an exceptional art installation that represents the core values of Facebook Canada, namely openness and connectivity. The piece is a stunning display of triply periodic minimal surfaces, also known as Gyroids, which are composed of intricately connected 2mm acrylic panels. The Gyroids were created using a sophisticated Grasshopper definition that provided precise digital fabrication and assembly data, resulting in a flawless execution. The installation comprises more than 7,000 clear acrylic pieces, each one representing a member of the global population of over 7 billion individuals. The interlocking pieces are held together by over 13,000 rivets, a testament to Facebook's transparent and collaborative approach to building communities."
ai08,2,"Manta is a visually striking and thought-provoking work of art, illustrating the power of design to express complex ideas and inspire meaningful connections. The installation evokes a sense of wonder and amazement, inviting viewers to engage with the piece and explore its intricate details. Through its dynamic form and interconnectedness, Manta embodies the very essence of Facebook's mission, serving as a reminder of the importance of fostering connections and building communities in today's rapidly changing world."
ai07,1,Introducing Hyperbolica Parabola — an extraordinary art installation that explores the fascinating world of Hyperboloid of Revolution Geometry. This captivating piece instrumentalizes this unique geometric form as a tool to correlate multiple domains and delve into the realms of design exploration.
ai07,2,"By harnessing the power of geometric representation, Hyperbolica Parabola becomes a conduit that bridges different domains of design, including structure, form, and construction. The Hyperboloid of Revolution Geometry serves as a visual representation that encapsulates and harmonizes these various aspects of design."
ai07,3,"This installation poses a compelling question: What are the surface conditions that intersect between design representations, such as geometry and material, and the actual physical realization of a structure? In other words, it explores the boundaries where design concepts meet the tangible manifestation of a building."
ai07,4,"The overall form of the Hyperboloid surface, coupled with its doubly ruled property, bestows it with both structural stability and constructional conventionality. The intersecting lines across the surface give rise to a diagrid pattern, creating a visually striking and structurally sound framework. These intersecting lines also hold the potential to be interpreted and translated as linear building elements, such as beams, further blurring the lines between design, structure, and construction."
ai07,5,"To bring Hyperbolica Parabola to life, meticulous physical hand-made models were created. These models served as a playground for exploring the design possibilities and constructability of the Hyperboloid of Revolution Geometry. Through an iterative process, various physical models were crafted, allowing for a deep understanding of the design's potential and the practical considerations of realizing it in the physical realm."
ai07,6,"Hyperbolica Parabola is a testament to the convergence of art, mathematics, and architectural principles. It invites viewers to contemplate the interplay between form and function, the boundaries between representation and reality, and the potential of geometric explorations in the world of design."
ai06,1,"Manta is an exceptional art installation that represents the core values of Facebook Canada, namely openness and connectivity. The piece is a stunning display of triply periodic minimal surfaces, also known as Gyroids, which are composed of intricately connected 2mm acrylic panels. The Gyroids were created using a sophisticated Grasshopper definition that provided precise digital fabrication and assembly data, resulting in a flawless execution. The installation comprises more than 7,000 clear acrylic pieces, each one representing a member of the global population of over 7 billion individuals. The interlocking pieces are held together by over 13,000 rivets, a testament to Facebook's transparent and collaborative approach to building communities."
ai06,2,"Manta is a visually striking and thought-provoking work of art, illustrating the power of design to express complex ideas and inspire meaningful connections. The installation evokes a sense of wonder and amazement, inviting viewers to engage with the piece and explore its intricate details. Through its dynamic form and interconnectedness, Manta embodies the very essence of Facebook's mission, serving as a reminder of the importance of fostering connections and building communities in today's rapidly changing world."
ai05,1,"The Tempo Vancouver is a visionary proposal for a temporary structure that symbolizes the defining traits of contemporary society - speed, change, transformation, and integration. Its dynamic form is in a constant state of transformation, offering a fluid and captivating experience for those who walk along its structure. As one moves through it, the Tempo takes on various images, depending on their speed and position, resulting in a multi-faceted and visually stimulating experience that embodies space, time, and movement."
ai05,2,"This unique structure not only engages the mind but also the body of its viewers, with two wings acting as urban furniture that provide comfortable seating, leaning, and lounging options. In addition, the middle network of strings serves as an interactive social platform that invites people to connect with one another. As they look through the string network, viewers' eyes may meet accidentally, creating a visual connection that is informal and spontaneous. Apart from being a social and educational medium, the string network also doubles as an interactive playground for children. Small plastic balls are installed on the strings, encouraging children to play and learn in an engaging and interactive environment."
ai05,3,"Overall, the Tempo Vancouver is a fascinating example of innovative and thought-provoking design, offering a unique and immersive experience that is both playful and meaningful. It underscores the potential of design to bring people together, fostering connections and stimulating social interaction in unexpected ways."
ai04,1,"The VoroNode shelf is a unique design that draws inspiration from the intricate appearance and non-linear cellular networking of endothelial cells in the human lung, as well as the logic of Voronoi diagrams. This shelf is composed of nodes, or joins, that branch out in a Voronoi-like pattern. The length of each branch varies according to the intended physical load of each shelf, ensuring optimal stability and weight distribution."
ai04,2,"Manta is a visually striking and thought-provoking work of art, illustrating the power of design to express complex ideas and inspire meaningful connections. The installation evokes a sense of wonder and amazement, inviting viewers to engage with the piece and explore its intricate details. Through its dynamic form and interconnectedness, Manta embodies the very essence of Facebook's mission, serving as a reminder of the importance of fostering connections and building communities in today's rapidly changing world."
ai04,3,"The VoroNode shelf project reflects on the aesthetic of systems, highlighting the interdependence between form and function. In contrast to traditional approaches that prioritize visual aesthetics, the VoroNode shelf emphasizes the intrinsic relationship between structure and function, drawing on inspiration from nature to create a design that is both visually striking and highly functional. Through this project, designers can explore the potential of systems-oriented design and develop a deeper understanding of the complex relationships between form, function, and aesthetics."
ai03,1,"Introducing the captivating Stripe Pavilion — a visionary structure that emerged from a competition aimed at shaping Stockholm's urban landscape in the 2030s. This adaptable pavilion represents a public face for visitors and tourists, drawing inspiration from the beloved stripe motif seen in Swedish culture."
ai03,2,"Developed within a research and design studio, the pavilion underwent a meticulous process using cutting-edge tools and technologies. From physical paper models to digital representations, the design team explored spatial and volumetric aspects, refining their vision along the way."
ai03,3,"Through folding and sculpting techniques, the stripe concept gained depth and dynamism, resulting in a visually engaging structure. The digital realm played a vital role, allowing for algorithmic exploration and optimization of the pavilion's form and performance."
ai03,4,"After extensive digital and physical prototyping, a comprehensive full-scale prototype was built to evaluate the project's feasibility and assess the composition of the stripes. This final prototype showcases the integration of material specificity and architectural vision, capturing the essence of a world-class city. Stripe is an architectural masterpiece that harmoniously blends Swedish heritage with innovative design, captivating viewers with its striking form and conceptual depth."
ai02,1,"The Pavilion with a honeycomb-inspired structure represents a remarkable achievement in architectural design that draws inspiration from nature. This innovative project seeks to leverage the structural geometry of honeycombs, which is highly valued for its high strength-to-weight ratio, allowing for the minimization of material usage and associated costs."
ai02,2,"The Pavilion showcases advanced architectural design strategies that rely on digital modeling and fabrication techniques. The use of these technologies is central to the production of this project and allows for the precise construction of complex geometries, such as those found in honeycombs, to create striking and intricate designs. This use of technology in the design process represents a significant shift in the practice of architecture and highlights the need for architects to embrace new technologies and adapt to emerging trends."
ai02,3,"Furthermore, the project is part of a broader conversation in contemporary architecture around the role of performative design in shaping the built environment. Performative design emphasizes the integration of performance-based criteria into the design process to optimize outcomes in terms of sustainability, energy efficiency, and user experience. The Pavilion is a prime example of how performative design can be used to create visually stunning structures while minimizing their environmental impact."
ai01,1,"Introducing the mesmerizing Kinetic Facade, a groundbreaking research study exploring the possibilities of a responsive cladding system. This innovative installation combines the power of sensors and a kinetic component to create a facade that interacts with light, dynamically adapting to the needs of the building."
ai01,2,"At the core of the design is a remarkable cladding system capable of folding and transforming in response to varying levels of light. By harnessing the potential of this dynamic element, the Kinetic Facade can provide precise control over the amount of light entering the building."
ai01,3,"When maximum illumination is desired, the cladding opens up, allowing 100% of the light to pass through and create a vibrant, well-lit interior space. Conversely, when a more controlled lighting atmosphere is required, the cladding can completely block the light, ensuring privacy and creating a more intimate environment."
ai01,4,"This adaptive and responsive nature of the Kinetic Facade offers not only practical benefits but also an artistic and dynamic visual experience. As the cladding gracefully transforms, it engages with its surroundings, captivating viewers and evoking a sense of wonder."
ai01,5,"Step into a world where architecture and technology seamlessly blend, where the boundaries between interior and exterior spaces blur, and where light becomes a living entity guided by the Kinetic Facade. Experience the transformative power of this innovative installation, as it creates a harmonious synergy between light, form, and function."
