project_id,order,text
cr10,1,"This modern new built house is a stunning example of contemporary architecture and design. With a minimalistic approach to its construction, this 6000 square foot property is built around an open concept layout that offers ample space and a free-flowing atmosphere. The house has three parking garages and a hidden main kitchen along with a secondary kitchen attached to it. The entrance area and family room have a void each, which creates a grand sense of spaciousness. A central garden area in the house offers a unique view from every corner of the house and brings in plenty of natural light. The glass corridors that connect the three cube-shaped units of the house add an element of sleek modernism and elevate the style of the house."
cr10,2,"The house has a basement that includes a gym with a view to the central garden, a sauna, and a theater room. It also features a master bedroom for guests, complete with a bar and a party area with a fireplace and a view to the backyard and central garden. The ground floor of the house boasts a spacious family room with a floating fireplace, which separates it from the dining area. The family room has a direct view of the backyard and a huge deck that extends the living area outside. The house has five bedrooms on the second floor and is equipped with smart home technology, allowing for effortless control of all systems. The flat roof adds to the contemporary aesthetic of the house and rounds out the modern design of this beautiful property. The design team is exploring various cladding options that can express a strong modern feel while maintaining a sense of hominess. They are using a combination of stone, metal, wood, and glass in different ways to find the best option. To make the design process faster and explore more options, the team is utilizing parametric methods and tools."
cr09,1,"This modern new built house is a remarkable feat of design and engineering. The unique feature of the house is that it can't have any windows on the side walls, which is compensated for by the use of skylights, a central void, and huge windows on the front and rear elevation, flooding the entire house with natural light. The basement of the house is designed with a separate entrance and two patios in front and back, which bring in more natural light and fresh air. The basement can be completely separated, offering privacy and independence for grandparents to live with their children. The ground floor is an open concept design, providing ample space for the family to interact and socialize. The house has a huge deck on the backside with access from the family room, where one can relax on a comfortable set of sofas during the summer months."
cr09,2,"The house is split on the garage walls edge, which offers the possibility of accommodating an extra floor on top of the garage as a library and home office space, complete with a nice fireplace and glass walls. The master bedroom has a high cathedral ceiling with two separate walk-in closets, one of which is connected to the on-suite. There is a big skylight on top of the master bathroom to bring in natural light while maintaining privacy. The smart system implemented in the house opens the skylight during the day and night, providing natural ventilation and making the bathroom a serene and relaxing space. This modern new built house is a masterpiece of design and engineering, offering the perfect blend of functionality and aesthetics, and a home where you can enjoy natural light and fresh air without compromising on privacy or comfort."
cr08,1,"The architectural retrofit of this existing building on top of a hill has completely transformed its appearance. The front elevation has been redesigned with the addition of a high-ceiling entrance area featuring a modern wood door and a huge glass showcase above it, highlighting a beautiful chandelier at night. A convenient walking closet has been added at the entrance, and a dining area on the left side complements the family room and kitchen. The existing stucco exterior cladding has been replaced with a combination of aluminum panes, wood composite, and milky stucco, all topped with high parapets to create a modern and minimalistic look. Vertical louvers have been added to the exterior of the entrance area to extend the feeling of the entrance void while keeping it welcoming and protected. The new hard landscape design features a stone landing in the entrance area and floating finished concrete with hidden linear lights. The breathtaking view of the sunset can now be fully appreciated from this beautifully updated building."
cr06,1,"Nestled in South Etobicoke, on a quiet dead-end street near a park, the Brawley Residence transforms a modest bungalow into a refined three-story retreat, balancing minimalism with warmth. This major renovation breathes new life into the home, incorporating a secondary suite in the basement, seamlessly connected to the main residence."
cr06,2,"At its heart, a central void invites sunlight deep into the interiors, creating a poetic interplay of light and shadow while enhancing natural ventilation. The design fosters a serene, inward-looking experience, anchored by a cozy backyard and an expansive rooftop patio, offering a tranquil escape with sunset views, a BBQ area, and a sink—perfect for intimate gatherings."
cr06,3,"The second floor’s layout prioritizes privacy and fluidity, with two master suites at the rear and two front-facing bedrooms sharing a dual-interconnected bathroom."
cr06,4,"Through a play of light, materiality, and movement, the Brawley Residence becomes more than a home—it is a living canvas, capturing the essence of time and space in an elegant, understated form"
cr05,1,"A stunning modern cottage located on a secluded island accessible only by boat. This unique property boasts an enviable position on a hill overlooking the lake, providing a breathtaking panoramic view of the sunrise and sunset. Our design ethos was to create a modern minimalist home while still embracing the island's vernacular materials. The result is a beautiful home that blends perfectly into its surroundings while still being a statement piece."
cr05,2,"One of the most notable features of this property is the path that leads from the boat dock to the entrance of the cottage. We designed the pathway to take advantage of the natural beauty of the island and give a sense of being at one with nature. Upon entering the cottage, you're immediately struck by the double-height ceiling, which creates a sense of space and light. The two separate levels next to each other, rather than on top of each other, further enhance the feeling of spaciousness. To ensure that the property is bathed in natural light and benefits from the surrounding fresh air, we designed the cottage to maximize ventilation and use wood for both the interior and exterior."
cr05,3,"Finally, we created a large deck that extends from the cottage, offering an uninterrupted view of the water. The perfect spot for soaking up the sun, enjoying a morning coffee or entertaining guests. Our design and architectural drawing of this project created a modern and minimalistic cottage that respects the island's vernacular materials and stunning surroundings. Its unique location and design make it a true one-of-a-kind property, perfect for those seeking peace, tranquility and a deep connection with nature."
cr04,1,"A modern dwelling that embodies the perfect balance of functionality, comfort, and low-maintenance design. We have focused on the importance of natural light and ventilation, which is evident in the design of this house. The central void acts as a natural light well and provides ventilation throughout the house. The open concept layout adds to the spacious feel of the house, with side access and heated driveway for convenience. The house boasts a smart system, which allows for easy control of lighting, sound, heating, and cooling. Two separate HVAC systems ensure efficient and controlled temperature regulation with a two-zone system."
cr04,2,"The rooftop and basement patios provide perfect spots for relaxation or entertainment, with the option of an outdoor space for all seasons. The house is designed to be low-maintenance, with carefully selected materials that require minimal upkeep, and a low-waste design that maximizes space. The home office is thoughtfully designed, with ample natural light to promote productivity and a peaceful environment. The House of Comfort is truly an embodiment of modern design and functional living, creating a comfortable and inviting environment that will serve as a haven for years to come. A triangle window on the second floor with a perfectly parallel slope to the roof. This design detail not only adds visual interest but also enhances the overall aesthetic appeal of the house."
cr04,3,"A stunning small bridge designed inside the house, connecting the front of the property to the rooftop patio. The bridge is visible from the ground floor, through the central void that hovers above the kitchen, allowing natural light to flood the entire house. The design is not only visually appealing but also functional, creating an easy and convenient access route for homeowners to enjoy the beautiful rooftop space."
cr03,1,"The residence, situated in Mimico, a neighbourhood in the western region of Toronto, underwent a comprehensive renovation that involved adding extensions at the back and above the bungalow structure. The design team worked within the confines of the existing footprint of the century-old fully detached house, retaining and reinforcing only the two side exterior walls of the original structure to qualify for an exemption from the zoning department. This enabled an increase in the living space of the residence, including the addition of a two-bedroom basement unit."
cr03,2,"The modern house boasts a total floor area of 3,500 square feet above ground, with an additional 1,200 square feet in the basement, situated on a 35x135 lot size. It features four bedrooms, three and a half bathrooms, and an attached garage above the ground. In addition, a separate basement unit is included in the design, complete with two bedrooms and a bathroom. The third floor of the building features a remarkable long bridge that connects the front of the house to the rooftop patio at the back. On the second floor, a striking display of walnut wood combined with black metal plates and LED strip lighting produces a modern and distinctive ambiance. The contrasting materials and clever use of lighting create an eye-catching and stylish space."
cr02,1,"The objective of this architectural project is to conceptualize an aesthetically pleasing, contemporary residence with sustainable, efficient, and comfortable features. The property is designed with a central division, whereby the rear aspect of the house is three-stories in height, while the front is two-stories, affording each room a degree of privacy and autonomy. Our team prioritized sustainability and efficient use of space, creating an energy-efficient dwelling that reduces waste and carbon emissions. The exterior cladding materials, namely cedar and stucco, were chosen to give the house a modern yet natural appearance that seamlessly integrates with the surrounding environment."
cr02,2,"The proposed architectural project aims to create an artistic minimal modern house that prioritizes sustainability, efficiency, and comfort. The house features a split design, with a three-story floor on the rear side and a two-story floor on the front portion, providing privacy and independence to each room. The design team has prioritized sustainability and efficient use of space, resulting in an energy-efficient house with a reduced carbon footprint. The use of cedar and stucco for cladding creates a natural and modern look that blends seamlessly with the surrounding environment."
cr02,3,"The open concept layout allows for the seamless merging of living, dining, and kitchen areas, while the ground floor's large windows on both the front and rear sides provide ample natural light. The void in the center of the house creates a visual connection between levels and allows natural light to enter the house. The remote-controlled skylights on top create natural ventilation by allowing hot air to escape and cool air to flow in. The master bedroom, located on the third floor on the rear side, offers privacy and a peaceful retreat from the rest of the house. The room is designed to maximize natural light and ventilation, with large windows and access to a private balcony. Each room features its separate bathroom, adding to the residents' privacy and comfort."
cr02,4,"The basement is a versatile space with a bedroom, separate washroom, living room, and bar, providing added value and flexibility to the house. It can be used as an entertainment area, guest suite, or rental unit. The entrance area features a minimal modern and compact fireplace designed integrated with the closet, adding a cozy feel to the space."
cr02,5,"The split concept in the middle of the house creates a unique island-like design, with each floor acting as an independent unit with its bedroom and bathroom. This design provides more privacy and comfort for the residents, allowing them to have their private space within the house. Overall, this artistic minimal modern house offers a sustainable, efficient, and comfortable space that maximizes natural light, ventilation, privacy, and efficient use of space. The island-like design, combined with a focus on sustainability and efficient energy use, makes it an ideal choice for modern living."
cr01,1,"This modern house boasts a minimalist design and is situated on a compact 20' by 80' corner lot in the bustling city of Toronto. With three bedrooms, the house features two bedrooms on the second floor that share a washroom in between. The third floor is dedicated to the master bedroom, which boasts a unique and stylish design with all walls and ceilings tilted."
cr01,2,"The open concept layout is enhanced by a dual system door/skylight from Denmark, which complements the building's angles and provides access to a private balcony on the third floor. An additional balcony is located on the second and half floor and is accessible via a modern wood staircase with a mono stringer design in the middle of the house. The staircase divides the building in half and offers picturesque views and an open feel throughout the house. The basement is a perfect home office space with a cozy room and separate washroom, ideal for working from home."
cr01,3,"Each room in the house has its own unique features that blend seamlessly to form a sleek and minimalistic design, finished with cedar and stucco. The house is illuminated with natural light from three sides, and benefits from natural ventilation via the staircase and skylights on top of them, providing a cozy and healthy living environment. With a combination of modern design, intelligent use of space, and ample natural light and ventilation, this house stands out as a true gem in the heart of the city."
muc09,1,"Light Breeze is a captivating multi-generational multiplex that redefines the concept of harmonious living in Toronto. With its innovative design and thoughtful amenities, this new typology of multiplex brings a refreshing breath of air to the city's housing landscape."
muc09,2,"Step inside, and you'll be greeted by a unique arrangement. The ground floor boasts a spacious unit, perfect for multi-generational families seeking convenience and togetherness. As you ascend to the second floor, two duplex units await, offering privacy and independence for each household."
muc09,3,"At the heart of Light Breeze lies a grand void that fills the building with natural light, illuminating even the darkest corners. This architectural marvel not only enhances the aesthetic appeal but also brings forth a sense of openness and connection to nature. The void serves as a channel for natural ventilation, promoting fresh air circulation throughout the building, ensuring a comfortable and sustainable living environment."
muc09,4,"But that's not all – Light Breeze takes full advantage of its flat roof to provide an eco-friendly touch. A lush green roof graces the top of the building, creating a serene oasis amidst the urban landscape. Residents can revel in the beauty of nature, unwind, and create cherished memories on the rooftop patio while taking in panoramic views of the city. Furthermore, solar panels adorn the roof, harnessing the power of the sun to promote sustainable energy consumption, reducing environmental impact and utility costs."
muc09,5,"Delving deeper into the design, Light Breeze places the bedrooms of both upper units on the second floor. This intentional placement acts as a sound buffer, ensuring tranquility in the family rooms below. Privacy, peace, and uninterrupted relaxation become synonymous with the living experience in this multiplex."
muc09,6,"Each unit within Light Breeze boasts its own private balcony, offering a personal outdoor retreat to soak in the vibrant cityscape or unwind with a cup of coffee. Additionally, every unit is equipped with a separate HVAC system, providing individual climate control and allowing residents to tailor their comfort to their own preferences."
muc09,7,"Light Breeze invites you to embrace a new era of multi-generational living, where convenience, sustainability, and harmonious design intersect. With its light-filled spaces, green initiatives, and personalized amenities, this multiplex stands as a testament to the possibilities of modern urban living. Welcome home to Light Breeze, where the winds of change bring a fresh and invigorating living experience for generations to come."
muc08,1,"The architectural design of Crazy Burger is a testament to the owner's vision of creating an inviting and visually striking space that complements the exceptional food served within its walls. The emphasis is on crafting an environment that combines elegance, coziness, and minimalism, providing patrons with a calm and enjoyable dining experience."
muc08,2,"Starting with the lighting design, dimmable pot lights and strategically placed strip LEDs are carefully integrated into the architecture to offer versatility and control over the ambiance. These lighting fixtures create a warm and welcoming atmosphere during evening hours, allowing guests to dine in a setting that is both intimate and enchanting."
muc08,3,"The interior layout of Crazy Burger is thoughtfully designed to optimize space while ensuring a comfortable dining experience. Limited in-house seating encourages a cozy and intimate atmosphere, allowing guests to enjoy their meals in a relaxed setting. Additionally, strategically positioned areas around the bar cater to those who prefer a quick take-away option, ensuring efficient service without compromising on comfort."
muc08,4,"A prominent architectural feature of Crazy Burger is the impressive fridge positioned behind the bar area. This large glass showcase serves as a focal point, enticing guests with a visually stunning display of the high-quality beef and ingredients used in their burgers. The fridge is cleverly integrated into the overall design, with a backdrop of vibrant green accents, adding a touch of freshness and visual appeal."
muc08,5,"Throughout the interior, a minimalist design approach is embraced, ensuring that the attention remains on the food and the overall dining experience. The architectural elements, such as clean lines, uncluttered spaces, and a harmonious colour palette, work together to create a visually pleasing and modern aesthetic."
muc08,6,"In summary, the architectural work for Crazy Burger is characterized by its attention to detail, functionality, and aesthetic appeal. From the carefully considered lighting design to the smart utilization of space, every element of the architecture contributes to creating an environment that elevates the enjoyment of the exceptional burgers served within the establishment. The result is an architectural masterpiece that seamlessly integrates with the culinary experience, providing a delightful and memorable visit for all patrons of Crazy Burger."
muc05,1,"Introducing the Missing Middle — a remarkable housing solution perfectly designed to bridge the gap between low-rise single-family homes and mid-rise apartments. This multiplex is thoughtfully crafted to meet the demands of modern families seeking a harmonious blend of comfort, convenience, and affordability."
muc05,2,"Each unit within the Missing Middle offers a spacious 1,600 square feet of living space, providing ample room for families of 4 or 5 to thrive. Featuring 3 bedrooms and a dedicated home office, this multiplex effortlessly balances work and family life. The clever layout ensures minimal sound pollution, allowing you to focus on your tasks while others enjoy their daily activities."
muc05,3,"Prepare to bask in an abundance of natural light that bathes every corner of these remarkable residences. Large windows and strategic positioning let the sun's rays effortlessly illuminate your living spaces, creating a warm and inviting atmosphere throughout the day."
muc05,4,"As you step onto the rooftop patio, a private oasis awaits. Enjoy breathtaking views of the surrounding neighborhood while savoring moments of relaxation or hosting unforgettable gatherings with loved ones. The rooftop patio becomes your personal sanctuary, a space to unwind and revel in the beauty of the outdoors."
muc05,5,"But the Missing Middle doesn't stop there. It leverages the unique topography of its location to accommodate a fourth unit in the lower level, ensuring that every inch of this property is utilized to its fullest potential. Natural light floods into this lower unit, creating a bright and welcoming ambiance that is a rarity in traditional basement living spaces. With thoughtful design and natural ventilation, this unit defies expectations, offering comfort and tranquility."
muc05,6,"Discover the Missing Middle — a housing marvel that provides the missing piece to the puzzle of affordable and accessible housing for middle-income households. Despite the challenges of Toronto's thriving population and high land costs, this multiplex stands as a testament to innovation and the pursuit of a balanced and sustainable urban lifestyle. Welcome home to a new era of living, where families thrive, work thrives, and community thrives."
muc04,1,"The Etihad Museum in Dubai, UAE is a museum that showcases the rich heritage of the United Arab Emirates. It exhibits various aspects of the country's social, political, cultural, scientific, and military history. The museum houses a wide range of items, including old passports and personal artifacts of the UAE rulers. It is also significant as it was the site where important historical events such as the signing of the UAE Constitution and the formation of the UAE as a country occurred. The museum is architecturally designed to represent the signing of the UAE constitution. With its unique design, the museum embodies the significance of this historical event. Admission to the museum for adults is priced at 25 AED (6.81 USD)."
muc04,2,"The museum, masterfully designed by Moriyama & Teshima Architects, showcases a harmonious blend of architectural elements and natural surroundings. One of the key contributors to this project was Hamia Aghaiemeibody, one of the Principals of Topdot Architects and former Head of Computation Design at Moriyama & Teshima Architects. With his expertise, he led and executed several crucial tasks that contributed to the museum's exceptional design and functionality."
muc04,3,"Hamia Aghaiemeibody's involvement included the design and form rationalization of the cladding, panelizing the cladding, and optimizing the fabrication process based on the intricate geometry of the museum. Additionally, he played a pivotal role in designing and preparing fabrication documents for the interior free-form surfaces, ensuring the highest level of craftsmanship and precision."
muc04,4,"The museum itself is a testament to the vision and collaboration of talented architects and designers. Its underground and above-ground spaces house permanent and temporary galleries, theatres, event spaces, and archival facilities. The entrance pavilion, gracefully situated above a reflective pool and plaza, captivates visitors with its curved parabolic form representing the historic parchment of the unification agreement. The slender golden columns symbolize the pens used to sign this momentous document."
muc04,5,"Inside the pavilion, the seamless transition from the travertine plaza to the interior reveals terraced viewing platforms and intricate bronze Jali screens, creating an open and flowing space. Natural light permeates the underground areas through various shaped lightwells, illuminating the captivating exhibitions within. As visitors explore, they are led to the circular Union House, the sacred site of the signing ceremony, and the meticulously recreated Guest House where the leaders of the seven emirates resided during negotiations."
muc04,6,"Surrounding the museum, the landscape design pays homage to the past by restoring the original 1971 shoreline of Jumeirah Beach. A reflective pool and sandy beachfront provide a serene and nostalgic atmosphere. This holistic approach, combined with the architectural ingenuity and attention to detail, ensures that every visitor experiences the museum as a captivating journey through history and design."
